{
  "$schema": "https://json-schema.org/draft/2020-12/schema",
  "$id": "lights.schema.json",
  "title": "Lights",
  "type": "array",
  "items": {
    "type": "object",
    "required": [
      "description",
      "radius",
      "strength",
      "color"
    ],
    "additionalProperties": false,
    "properties": {
      "description": {
        "type": "string",
        "description": "Description of where or what the light applies to."
      },
      "worldX": {
        "type": "integer",
        "description": "The non-instanced world X coordinate to spawn the light on. Used in combination with worldY and plane."
      },
      "worldY": {
        "type": "integer",
        "description": "The non-instanced world Y coordinate to spawn the light on. Used in combination with worldX and plane."
      },
      "plane": {
        "type": "integer",
        "description": "The world Z coordinate, or plane to spawn the light on. Used in combination with worldX and worldY."
      },
      "alignment": {
        "type": "string",
        "enum": [
          "CUSTOM",
          "CENTER",

          "NORTH",
          "NORTHEAST",
          "NORTHEAST_CORNER",
          "EAST",
          "SOUTHEAST",
          "SOUTHEAST_CORNER",
          "SOUTH",
          "SOUTHWEST",
          "SOUTHWEST_CORNER",
          "WEST",
          "NORTHWEST",
          "NORTHWEST_CORNER",

          "BACK",
          "BACKLEFT",
          "BACKLEFT_CORNER",
          "LEFT",
          "FRONTLEFT",
          "FRONTLEFT_CORNER",
          "FRONT",
          "FRONTRIGHT",
          "FRONTRIGHT_CORNER",
          "RIGHT",
          "BACKRIGHT",
          "BACKRIGHT_CORNER"
        ],
        "description": "Where to place the light in relation to what it's attached to, be it an NPC, object or world location."
      },
      "offset": {
        "type": "array",
        "description": "The light's position relative to the center of the model it's attached to, before rotation. Only applies if alignment is set to CUSTOM, which is the default.",
        "minItems": 3,
        "maxItems": 3,
        "items": {
          "type": "number"
        }
      },
      "height": {
        "type": "integer",
        "description": "The height in scene units (128 per tile) to place the light above the current tile or entity base height."
      },
      "radius": {
        "type": "integer",
        "description": "How far the light should reach in all directions. Defaults to 300."
      },
      "strength": {
        "type": "number",
        "description": "Light strength multiplier. Defaults to 5."
      },
      "color": {
        "type": [ "string", "array" ],
        "description": "Light color in sRGB, specified as a hex color code or an array in the range 0-255, which accepts decimals.",
        "pattern": "^#[A-Fa-f0-9]{6}$",
        "minItems": 3,
        "maxItems": 3,
        "items": {
          "type": "number"
        }
      },
      "type": {
        "type": "string",
        "description": "Specify the animation to apply to the light. Defaults to STATIC.",
        "enum": [ "STATIC", "FLICKER", "PULSE" ]
      },
      "duration": {
        "type": "number",
        "description": "The time to complete one cycle of the light type's animation. Currently only affects PULSE lights."
      },
      "range": {
        "type": "number",
        "description": "The distance range to vary the light's radius by according to the light's animation."
      },
      "fadeInDuration": {
        "type": "number",
        "description": "The time in milliseconds until the light is fully active after spawning. May overlap with fade-out if overlap is enabled."
      },
      "fadeOutDuration": {
        "type": "number",
        "description": "The time in milliseconds until the light is fully inactive after despawning. May overlap with fade-in if overlap is enabled."
      },
      "fadeOverlap": {
        "type": "boolean",
        "description": "If enabled, fade-in and fade-out can overlap if spaced close enough together."
      },
      "spawnDelay": {
        "type": "number",
        "description": "The time in milliseconds between the light spawning and the light beginning to fade in."
      },
      "despawnDelay": {
        "type": "number",
        "description": "The time in milliseconds between the light despawning and the light beginning to fade out."
      },
      "fixedDespawnTime": {
        "type": "boolean",
        "description": "If enabled, the light will have faded out completely after spawnDelay + despawnDelay milliseconds."
      },
      "despawnWithParent": {
        "type": "boolean",
        "description": "If enabled, the light will immediately despawn if whatever it's attached to despawns."
      },
      "visibleFromOtherPlanes": {
        "type": "boolean",
        "description": "Whether the light should be hidden when it appears on a different plane than the current. Defaults to false."
      },
      "ignoreActorHiding": {
        "type": "boolean",
        "description": "Don't hide the light if its actor is hidden by another actor drawing on top. Defaults to false."
      },
      "renderableIndex": {
        "type": "integer",
        "description": "Specify which of the two possible `Renderable`s for `DecorativeObject`s and `WallObject`s the light should be added for. If not specified, a light will be added only for the first non-null `Renderable`."
      },
      "waitForAnimation": {
        "type": "boolean",
        "description": "Whether the light should spawn only when an animation starts playing. Only works for `GraphicsObject`s and `Projectile`s. Defaults to false."
      },
      "nightMultiplier": {
        "type": "number",
        "minimum": 0,
        "description": "Overworld night brightness multiplier while the daylight cycle is active. Defaults to 1; 0 disables the light and values above 1 brighten it."
      },
      "schedule": {
        "description": "When the light turns on or off based on the sun's altitude. Scheduled lights are disabled when the daylight cycle is disabled.",
        "oneOf": [
          { "$ref": "#/$defs/lightScheduleRange" },
          {
            "type": "object",
            "additionalProperties": false,
            "required": [ "during" ],
            "properties": {
              "turn": {
                "type": "string",
                "enum": [ "ON", "OFF" ],
                "default": "ON",
                "description": "Whether the listed ranges enable or disable the light."
              },
              "during": {
                "oneOf": [
                  { "$ref": "#/$defs/lightScheduleRange" },
                  {
                    "type": "array",
                    "minItems": 1,
                    "items": { "$ref": "#/$defs/lightScheduleRange" }
                  }
                ]
              },
              "randomOffset": {
                "type": "number",
                "minimum": 0,
                "default": 2.7,
                "description": "Stable per-instance altitude offset in degrees, applied in either direction. Defaults to 2.7."
              }
            }
          }
        ]
      },
      "outdoorLighting": {
        "oneOf": [
          {
            "type": "boolean"
          },
          {
            "type": "array",
            "minItems": 3,
            "maxItems": 3,
            "items": {
              "type": "integer"
            }
          }
        ],
        "description": "Sample the default overworld lighting if true, or specify a world position to sample. Defaults to false."
      },
      "areas": {
        "type": "array",
        "description": "An array of bounding boxes and/or area enums specifying which areas the light should be limited to.",
        "items": {
          "$ref": "aabb.schema.json"
        }
      },
      "excludeAreas": {
        "type": "array",
        "description": "An array of areas where the light shouldn't be able to spawn.",
        "items": {
          "$ref": "aabb.schema.json"
        }
      },
      "npcIds": {
        "type": "array",
        "description": "A set of NPC gameval names to apply the light to.",
        "items": {
          "type": "string"
        }
      },
      "objectIds": {
        "type": "array",
        "description": "A set of object gameval names to apply the light to.",
        "items": {
          "type": "string"
        }
      },
      "projectileIds": {
        "type": "array",
        "description": "A set of projectile gameval names to apply the light to.",
        "items": {
          "type": "string"
        }
      },
      "graphicsObjectIds": {
        "type": "array",
        "description": "A set of graphics object gameval names to apply the light to.",
        "items": {
          "type": "string"
        }
      },
      "animationIds": {
        "type": "array",
        "description": "A set of animation gameval names to display the light for, or the special value `-1` for no animation. Must be specified alongside an NPC or other thing to watch for animations on.",
        "items": {
          "type": [ "string", "number" ]
        }
      },
      "excludeAnimationIds": {
        "type": "array",
        "description": "A set of animation gameval names to hide the light during, or the special value `-1` for no animation. If animationIds is empty, the light displays for every other animation. Must be specified alongside an NPC or other thing to watch for animations on.",
        "items": {
          "type": [ "string", "number" ]
        }
      }
    }
  },
  "$defs": {
    "lightSchedulePhase": {
      "type": "string",
      "enum": [ "DAWN", "SUNRISE", "DAY", "SUNSET", "DUSK", "NIGHT", "DEEP_NIGHT" ]
    },
    "lightScheduleEndpoint": {
      "oneOf": [
        {
          "type": "string",
          "enum": [ "DAWN", "SUNRISE", "DAY", "SUNSET", "DUSK", "NIGHT", "DEEP_NIGHT" ]
        },
        {
          "type": "number",
          "minimum": -90,
          "maximum": 90
        }
      ]
    },
    "lightScheduleRange": {
      "oneOf": [
        { "$ref": "#/$defs/lightSchedulePhase" },
        {
          "type": "object",
          "additionalProperties": false,
          "required": [ "from", "through" ],
          "properties": {
            "from": { "$ref": "#/$defs/lightScheduleEndpoint" },
            "through": { "$ref": "#/$defs/lightScheduleEndpoint" },
            "mode": {
              "type": "string",
              "enum": [ "ASCENDING", "DESCENDING", "BOTH" ],
              "default": "BOTH",
              "description": "Restrict the range to the sun rising or setting. BOTH applies regardless of direction."
            }
          }
        }
      ]
    }
  }
}
